{
  "$schema": "https://github.com/mcorbett51090/RavenClaude/schemas/design-schema.schema.json",
  "source": {
    "url": "https://example.com",
    "fetched_at": "2026-08-13T00:00:00Z",
    "title": "Example Co."
  },
  "capture_method": "static",
  "spacing": {
    "base_unit": 8,
    "scale": [4, 8, 16, 24, 32, 48],
    "capture_method": "static"
  },
  "type_scale": {
    "base_size": 16,
    "ratio": 1.25,
    "sizes": [12, 14, 16, 20, 25, 31],
    "capture_method": "static"
  },
  "grid": {
    "breakpoints": ["640px", "1024px"],
    "columns": 12,
    "gutter": "24px",
    "container_max": "1200px",
    "capture_method": "static"
  },
  "elevation": {
    "shadows": [
      "0 1px 2px rgba(0,0,0,0.05)",
      "0 2px 8px rgba(0,0,0,0.1)",
      "0 8px 24px rgba(0,0,0,0.16)"
    ],
    "capture_method": "static"
  },
  "components": [
    {
      "name": "button",
      "anatomy": ["label"],
      "recipe": {
        "padding": "8px 16px",
        "border-radius": "4px",
        "font-size": "14px"
      }
    },
    {
      "name": "card",
      "anatomy": ["media", "heading", "body"],
      "recipe": {
        "padding": "24px",
        "border-radius": "8px",
        "box-shadow": "0 2px 8px rgba(0,0,0,0.1)"
      }
    },
    {
      "name": "nav",
      "anatomy": ["logo-slot", "link-list"],
      "recipe": {
        "padding": "16px 24px",
        "gap": "24px"
      }
    }
  ],
  "brand_kit_ref": null,
  "identity_flags": [
    {
      "kind": "logo",
      "evidence": "img[alt~='logo'] found in header region",
      "action": "human-decision"
    }
  ],
  "confidence_notes": [
    "spacing.base_unit fit at residual 0.02 for base 8 vs 0.31 for base 4",
    "type_scale.ratio fit at residual 0.01 for 1.25 vs 0.09 for 1.2"
  ]
}
